{
  "$schema": "http://json-schema.org/draft-07/schema#",
  "$id": "https://weltgewebe.org/schemas/domain/edge.schema.json",
  "title": "Edge",
  "description": "A derived Faden projection between two entities. Newly derived, unverzwirnte Fäden expire exactly 168 hours after their server-owned creation timestamp; durable Webungsaktionen remain outside this projection.",
  "type": "object",
  "properties": {
    "id": {
      "type": "string",
      "format": "uuid"
    },
    "source_type": {
      "type": "string",
      "enum": ["role", "node", "account"]
    },
    "source_id": {
      "type": "string",
      "format": "uuid"
    },
    "target_type": {
      "type": "string",
      "enum": ["role", "node", "account"]
    },
    "target_id": {
      "type": "string",
      "format": "uuid"
    },
    "edge_kind": {
      "type": "string",
      "enum": ["delegation", "membership", "ownership", "reference"]
    },
    "created_at": {
      "description": "Server-owned creation timestamp of the derived projection.",
      "type": "string",
      "format": "date-time"
    },
    "expires_at": {
      "description": "Server-owned active-projection boundary. For every unverzwirnter Faden this is exactly 168 hours after created_at. When a legacy record has created_at but no persisted expires_at, readers derive the same boundary without rewriting history. Complete absence of lifecycle timestamps is reserved for undated legacy data; a future durable Garn requires an explicit representation.",
      "type": "string",
      "format": "date-time"
    },
    "note": {
      "type": "string",
      "minLength": 1,
      "maxLength": 1000
    }
  },
  "required": ["id", "source_type", "source_id", "target_type", "target_id", "edge_kind", "created_at"],
  "additionalProperties": false
}
