{
  "id": "c2f5b8a0-7b3e-4d5a-8e1f-0a7b4f3a4b1e",
  "source_type": "node",
  "source_id": "a6e1f3a4-7b4f-4d2a-9e6f-0a7b4f3a4b1e",
  "target_type": "role",
  "target_id": "b3e2f4a5-8c5d-4e3b-9f7a-1b8c5f4a5b2f",
  "edge_kind": "ownership",
  "created_at": "2024-01-15T10:05:00Z",
  "note": "Eigent√ºmerschaft des Marktplatzes durch die Stadt."
}
